{
  "kind": "molecule",
  "id": "molecule-formaldehyde",
  "title": "Formaldehyde",
  "formula": "CH2O",
  "latex": "\\mathrm{CH_{2}O}",
  "names": [
    "formaldehyde",
    "methanal"
  ],
  "charge": 0,
  "valence_electrons": 12,
  "valence_breakdown": [
    {
      "symbol": "C",
      "count": 1,
      "per_atom": 4,
      "subtotal": 4
    },
    {
      "symbol": "H",
      "count": 2,
      "per_atom": 1,
      "subtotal": 2
    },
    {
      "symbol": "O",
      "count": 1,
      "per_atom": 6,
      "subtotal": 6
    }
  ],
  "electron_check": {
    "bonding": 8,
    "nonbonding": 4,
    "total": 12
  },
  "atoms": [
    {
      "id": "C1",
      "element": "C",
      "lone_pairs": 0,
      "bond_order_sum": 4,
      "formal_charge": 0
    },
    {
      "id": "O1",
      "element": "O",
      "lone_pairs": 2,
      "bond_order_sum": 2,
      "formal_charge": 0
    },
    {
      "id": "H1",
      "element": "H",
      "lone_pairs": 0,
      "bond_order_sum": 1,
      "formal_charge": 0
    },
    {
      "id": "H2",
      "element": "H",
      "lone_pairs": 0,
      "bond_order_sum": 1,
      "formal_charge": 0
    }
  ],
  "bonds": [
    {
      "a": "C1",
      "b": "O1",
      "order": 2,
      "between": [
        "C",
        "O"
      ],
      "delta_en": "0.89",
      "bond_class": "polar-covalent",
      "polar": true
    },
    {
      "a": "C1",
      "b": "H1",
      "order": 1,
      "between": [
        "C",
        "H"
      ],
      "delta_en": "0.35",
      "bond_class": "nonpolar-covalent",
      "polar": false
    },
    {
      "a": "C1",
      "b": "H2",
      "order": 1,
      "between": [
        "C",
        "H"
      ],
      "delta_en": "0.35",
      "bond_class": "nonpolar-covalent",
      "polar": false
    }
  ],
  "geometry": {
    "central": "C1",
    "central_element": "C",
    "domains": 3,
    "lone_pairs": 0,
    "electron_geometry": "trigonal planar",
    "molecular_shape": "trigonal planar",
    "ideal_angle": "120°",
    "source": "openstax-chemistry-2e"
  },
  "summary": "Twelve valence electrons: two C–H single bonds, one C=O double bond, and two lone pairs on oxygen. Carbon has three electron domains (two single bonds and one double bond count as three domains) and no lone pairs, so the molecule is trigonal planar, angles near 120°. Unlike carbon dioxide, the three bonds are not identical: the strong C=O dipole (ΔEN 0.89) is not balanced by the two weak C–H dipoles (ΔEN 0.35), so the flat molecule has a net dipole toward oxygen — it is polar. Geometry alone does not settle polarity; the bonds have to match too.",
  "source": "openstax-chemistry-2e",
  "en_source": "allred-1961-electronegativity",
  "bonding_source": "openstax-chemistry-2e",
  "related": [
    {
      "to": "lewis-structure",
      "type": "concept"
    },
    {
      "to": "vsepr",
      "type": "concept"
    },
    {
      "to": "molecule-carbon-dioxide",
      "type": "trigonal-planar-polar vs linear-nonpolar"
    }
  ],
  "lessons": [],
  "polarity": "polar",
  "polarity_reason": "Trigonal planar, but the bonds differ: the strong C=O dipole is not cancelled by the two weak C–H dipoles, leaving a net dipole toward oxygen.",
  "intermolecular": {
    "dominant": "dipole-dipole",
    "forces": [
      "london-dispersion",
      "dipole-dipole"
    ],
    "h_bond_donor": false
  }
}
