{
  "kind": "molecule",
  "id": "molecule-methane",
  "title": "Methane",
  "formula": "CH4",
  "latex": "\\mathrm{CH_{4}}",
  "names": [
    "methane"
  ],
  "charge": 0,
  "valence_electrons": 8,
  "valence_breakdown": [
    {
      "symbol": "C",
      "count": 1,
      "per_atom": 4,
      "subtotal": 4
    },
    {
      "symbol": "H",
      "count": 4,
      "per_atom": 1,
      "subtotal": 4
    }
  ],
  "electron_check": {
    "bonding": 8,
    "nonbonding": 0,
    "total": 8
  },
  "atoms": [
    {
      "id": "C1",
      "element": "C",
      "lone_pairs": 0,
      "bond_order_sum": 4,
      "formal_charge": 0
    },
    {
      "id": "H1",
      "element": "H",
      "lone_pairs": 0,
      "bond_order_sum": 1,
      "formal_charge": 0
    },
    {
      "id": "H2",
      "element": "H",
      "lone_pairs": 0,
      "bond_order_sum": 1,
      "formal_charge": 0
    },
    {
      "id": "H3",
      "element": "H",
      "lone_pairs": 0,
      "bond_order_sum": 1,
      "formal_charge": 0
    },
    {
      "id": "H4",
      "element": "H",
      "lone_pairs": 0,
      "bond_order_sum": 1,
      "formal_charge": 0
    }
  ],
  "bonds": [
    {
      "a": "C1",
      "b": "H1",
      "order": 1,
      "between": [
        "C",
        "H"
      ],
      "delta_en": "0.35",
      "bond_class": "nonpolar-covalent",
      "polar": false
    },
    {
      "a": "C1",
      "b": "H2",
      "order": 1,
      "between": [
        "C",
        "H"
      ],
      "delta_en": "0.35",
      "bond_class": "nonpolar-covalent",
      "polar": false
    },
    {
      "a": "C1",
      "b": "H3",
      "order": 1,
      "between": [
        "C",
        "H"
      ],
      "delta_en": "0.35",
      "bond_class": "nonpolar-covalent",
      "polar": false
    },
    {
      "a": "C1",
      "b": "H4",
      "order": 1,
      "between": [
        "C",
        "H"
      ],
      "delta_en": "0.35",
      "bond_class": "nonpolar-covalent",
      "polar": false
    }
  ],
  "geometry": {
    "central": "C1",
    "central_element": "C",
    "domains": 4,
    "lone_pairs": 0,
    "electron_geometry": "tetrahedral",
    "molecular_shape": "tetrahedral",
    "ideal_angle": "109.5°",
    "source": "openstax-chemistry-2e"
  },
  "summary": "Eight valence electrons: four C–H bonding pairs, no lone pairs. Four electron domains and no lone pairs give a symmetric tetrahedron, bond angles 109.5°. The C–H bond is barely polar (ΔEN 0.35, on the nonpolar side of the guideline), and the four identical bonds point to the corners of a tetrahedron, so their small dipoles cancel — methane is nonpolar twice over: nearly nonpolar bonds arranged symmetrically.",
  "source": "openstax-chemistry-2e",
  "en_source": "openstax-chemistry-2e",
  "bonding_source": "openstax-chemistry-2e",
  "related": [
    {
      "to": "lewis-structure",
      "type": "concept"
    },
    {
      "to": "vsepr",
      "type": "concept"
    }
  ],
  "lessons": [
    "boiling-points-and-imfs"
  ],
  "polarity": "nonpolar",
  "polarity_reason": "Four identical C–H bonds point to the corners of a symmetric tetrahedron, so any bond dipoles cancel; the C–H bond is nearly nonpolar to begin with (ΔEN 0.35).",
  "intermolecular": {
    "dominant": "london-dispersion",
    "forces": [
      "london-dispersion"
    ],
    "h_bond_donor": false,
    "boiling_point_c": "-161.5",
    "phase_change": "boiling",
    "boiling_source": "openstax-chemistry-2e"
  }
}
